{
  "schemaVersion": "1.0.0",
  "reportId": "lip-sync-review.fixture.pass",
  "reviewPolicyVersion": "cx503.1",
  "reviewScope": "pronunciation_subtitle_lip_sync",
  "productionReadiness": "not_evaluated",
  "authority": "human_review_export_not_promotion_authority",
  "overallStatus": "lip_sync_passed",
  "sourceManifestId": "manifest.fixture",
  "sourceManifestContentHash": "sha256:1111111111111111111111111111111111111111111111111111111111111111",
  "sourceBundleId": "bundle.fixture",
  "sourceBundleContentHash": "sha256:2222222222222222222222222222222222222222222222222222222222222222",
  "language": "zh-CN",
  "reviewerSubject": "sha256:3333333333333333333333333333333333333333333333333333333333333333",
  "startedAtUtc": "2026-07-16T14:00:00Z",
  "completedAtUtc": "2026-07-16T14:05:00Z",
  "totalResponseCount": 1,
  "reviewableCount": 1,
  "passedCount": 1,
  "redoCount": 0,
  "blockedCount": 0,
  "items": [
    {
      "responseId": "response.fixture",
      "sourceNodeIds": ["node.fixture"],
      "dialogue": {
        "localizationKey": "story.fixture.response",
        "text": "锁定台词",
        "contentHash": "sha256:4444444444444444444444444444444444444444444444444444444444444444"
      },
      "emotionLocalizationKey": "story.fixture.emotion",
      "emotionText": "平静",
      "lipSyncMedia": {
        "mediaRef": "video.fixture",
        "assetVersion": "v1",
        "contentHash": "sha256:5555555555555555555555555555555555555555555555555555555555555555",
        "mediaType": "video"
      },
      "audioMedia": {
        "mediaRef": "audio.fixture",
        "assetVersion": "v1",
        "contentHash": "sha256:6666666666666666666666666666666666666666666666666666666666666666",
        "mediaType": "audio"
      },
      "fallbackMedia": {
        "mediaRef": "fallback.fixture",
        "assetVersion": "v1",
        "contentHash": "sha256:7777777777777777777777777777777777777777777777777777777777777777",
        "mediaType": "image"
      },
      "presentationHash": "sha256:8888888888888888888888888888888888888888888888888888888888888888",
      "sourceReadinessStatus": "needs_review",
      "sourceIssueCodes": ["human_review.required", "source.original_missing"],
      "videoPlaybackCompleted": true,
      "videoPlayedMilliseconds": 8000,
      "audioPlaybackCompleted": true,
      "audioPlayedMilliseconds": 7500,
      "decision": "pass",
      "checks": {
        "rawAudioUnmasked": true,
        "pronunciationPassed": true,
        "subtitlePassed": true,
        "lipSyncPassed": true
      },
      "reasonCodes": [],
      "reviewedAtUtc": "2026-07-16T14:04:00Z",
      "finalEventHash": "sha256:b4d75a3379777435ea3d074c056e1ef7aafbbd6a2ec360b9825b0d714716e48c"
    }
  ],
  "blockedItems": [],
  "events": [
    {
      "sequence": 1,
      "responseId": "response.fixture",
      "manifestContentHash": "sha256:1111111111111111111111111111111111111111111111111111111111111111",
      "dialogueContentHash": "sha256:4444444444444444444444444444444444444444444444444444444444444444",
      "presentationHash": "sha256:8888888888888888888888888888888888888888888888888888888888888888",
      "revision": 3,
      "videoPlaybackCompleted": true,
      "videoPlayedMilliseconds": 8000,
      "audioPlaybackCompleted": true,
      "audioPlayedMilliseconds": 7500,
      "decision": "pass",
      "checks": {
        "rawAudioUnmasked": true,
        "pronunciationPassed": true,
        "subtitlePassed": true,
        "lipSyncPassed": true
      },
      "reasonCodes": [],
      "recordedAtUtc": "2026-07-16T14:04:00Z",
      "previousEventHash": null,
      "eventHash": "sha256:b4d75a3379777435ea3d074c056e1ef7aafbbd6a2ec360b9825b0d714716e48c"
    }
  ],
  "contentHash": "sha256:776daf13502c0455f255cb6a1b7f7b4a1eceb251303833899d900b31692c1063"
}
